{
  "$schema": "http://json-schema.org/draft-07/schema#",
  "$id": "https://raw.githubusercontent.com/EchoEnv/semanticdf/main/schemas/manifest.schema.json",
  "title": "semanticdf manifest",
  "description": "JSON Schema for the semanticdf `SemanticManifest` artifact. v0.1.11+; older schemaVersions parse via the prefix-match gate but are not validated by this schema.",
  "type": "object",
  "required": ["schemaVersion", "kind", "model"],
  "additionalProperties": true,
  "properties": {
    "schemaVersion": {
      "type": "string",
      "pattern": "^v0\\.1\\.",
      "description": "Wire-format version of the manifest. Bumped on backwards-incompatible changes. v0.1.9, v0.1.10, v0.1.11 are all valid."
    },
    "kind": {
      "type": "string",
      "enum": ["semanticdf-model-manifest", "semanticdf-joined-manifest"],
      "description": "Discriminator between single-table and joined-manifest kinds. Currently only single-table is implemented; joined is a future recipe."
    },
    "compiledAt": {
      "type": "string",
      "format": "date-time",
      "description": "ISO 8601 timestamp of when this artifact was emitted."
    },
    "manifestVersion": {
      "type": "string",
      "pattern": "^\\d+\\.\\d+\\.\\d+",
      "description": "Semver of the manifest spec. Pre-1.0 (0.x.x) for evolving specs; 1.0.0+ for stable. Defaults to '0.1.0' if absent."
    },
    "$schema": {
      "type": "string",
      "format": "uri",
      "description": "URL of the JSON Schema document for validation. Tooling can fetch this and validate the manifest shape."
    },
    "id": {
      "type": "string",
      "pattern": "^[a-z][a-z0-9_]*(\\.[a-z][a-z0-9_]*)+$",
      "description": "Reverse-DNS FQN of the model. Globally unique. Used for cross-referencing between manifests (joined-manifest recipe, future lineage work)."
    },
    "namespace": {
      "type": "string",
      "description": "Multi-env deployment scoping (e.g. 'dev', 'prod', 'team-X'). Defaults to 'default' if absent."
    },
    "metadata": {
      "type": "object",
      "description": "Free-form audit object. Flat string values only (recipe §11 Q7). Conventional keys: author, license, tags, sourceRepo, sourceCommit.",
      "additionalProperties": { "type": "string" }
    },
    "model": {
      "type": "object",
      "required": ["name", "version", "status"],
      "properties": {
        "name":        { "type": "string" },
        "version":     { "type": "integer", "minimum": 0 },
        "status":      { "type": "string", "enum": ["draft", "published", "deprecated"] },
        "description": { "type": "string" },
        "sourceTable": { "type": "string" },
        "left":        { "$ref": "#/$defs/single-table-manifest" },
        "right":       { "$ref": "#/$defs/single-table-manifest" },
        "join": {
          "type": "object",
          "required": ["cardinality"],
          "properties": {
            "cardinality": { "type": "string", "enum": ["one", "many", "cross"] },
            "leftKeys":    { "type": "array", "items": { "type": "string" } },
            "rightKeys":   { "type": "array", "items": { "type": "string" } }
          }
        }
      }
    },
    "dimensions": {
      "type": "array",
      "items": {
        "type": "object",
        "required": ["name", "kind", "expr", "isTimeDimension", "isEntity", "isDerived"],
        "properties": {
          "name":              { "type": "string" },
          "kind":              { "type": "string" },
          "expr":              { "type": "string" },
          "isTimeDimension":   { "type": "boolean" },
          "isEntity":          { "type": "boolean" },
          "smallestTimeGrain": { "type": ["string", "null"] },
          "isDerived":         { "type": "boolean" }
        }
      }
    },
    "measures": {
      "type": "array",
      "items": {
        "type": "object",
        "required": ["name", "kind", "expr", "dependsOn"],
        "properties": {
          "name":      { "type": "string" },
          "kind":      { "type": "string", "enum": ["base", "calc"] },
          "expr":      { "type": "string" },
          "dependsOn": { "type": "array", "items": { "type": "string" } }
        }
      }
    },
    "joins":     { "type": "array" },
    "filters":   { "type": "array" },
    "transforms": {
      "type": "array",
      "items": {
        "type": "object",
        "required": ["name", "expr"],
        "properties": {
          "name":        { "type": "string" },
          "expr":        { "type": "string" },
          "description": { "type": ["string", "null"] }
        }
      }
    },
    "runtime": {
      "type": "object",
      "description": "Runtime tuning options for the model. Preserved across the manifest round-trip so YAML-deploys can carry non-default tuning. Missing \u0060runtime\u0060 block \u2192 use library defaults. Only emitted when at least one field is non-default.",
      "properties": {
        "maxRows": {
          "type": "integer",
          "minimum": 0,
          "description": "Driver-memory safety cap on rows. 0 disables the cap (escape hatch, mirrors the fluent chain convention)."
        },
        "broadcastJoinThreshold": {
          "type": "integer",
          "minimum": 1,
          "description": "Opt-in auto-broadcast threshold for join_one/join_many, in bytes. Absent means no library override (Spark's autoBroadcastJoinThreshold applies)."
        },
        "materializeLevel": {
          "type": "object",
          "description": "Opt-in DataFrame persistence (Spark StorageLevel) for the fast path of toDataFrame. Encoded as 5 fields (useDisk/useMemory/useOffHeap/deserialized/replication) for lossless round-trip of all 13 standard named StorageLevels and any custom-built instance. Absent means no persist (the library default).",
          "required": ["useDisk", "useMemory", "useOffHeap", "deserialized", "replication"],
          "properties": {
            "useDisk":      { "type": "boolean", "description": "Allow storage on local disk." },
            "useMemory":    { "type": "boolean", "description": "Allow storage in JVM heap." },
            "useOffHeap":   { "type": "boolean", "description": "Allow storage in off-heap memory (requires spark.memory.offHeap.enabled=true)." },
            "deserialized": { "type": "boolean", "description": "Store as deserialized Java objects (true) or serialized bytes (false). Serialized reduces memory but adds CPU." },
            "replication":  { "type": "integer", "minimum": 1, "description": "Replication factor (1 = no replication; >1 trades memory for fault tolerance)." }
          }
        },
        "salt": {
          "type": "integer",
          "minimum": 1,
          "description": "Opt-in skew-handling hint for equi-joins. When set, the library configures Spark AQE skew handling (`spark.sql.adaptive.skewJoin.skewedPartitionFactor = n`) so skewed partitions are broadcast automatically. Absent means no skew handling (the library default)."
        }
      }
    },
    "digest":    { "type": "object" },
    "warnings":  { "type": "array", "items": { "type": "string" } }
  },

  "$defs": {
    "single-table-manifest": {
      "type": "object",
      "description": "Per-side embedded single-table manifest inside a joined envelope (the joined-manifest recipe)."
    }
  }
}
