{"schemaVersion":"v0.1.9-manifest","kind":"semanticdf-model-manifest","compiledAt":"2026-07-21T21:54:25.492193488Z","model":{"name":"orders","version":0,"status":"published","description":"Per-order data with fulfillment timestamps and amount","sourceTable":"orders_csv"},"digest":{"dimensions":4,"timeDimensions":1,"derivedTimeDimensions":0,"measures":6,"calcMeasures":2,"joins":0,"filters":0,"isStreaming":false,"usesTAll":false},"dimensions":[{"name":"order_id","kind":"categorical","expr":"order_id","isTimeDimension":false,"isEntity":false,"smallestTimeGrain":null,"isDerived":false},{"name":"customer_id","kind":"categorical","expr":"customer_id","isTimeDimension":false,"isEntity":false,"smallestTimeGrain":null,"isDerived":false},{"name":"order_date","kind":"time","expr":"order_date","isTimeDimension":true,"isEntity":false,"smallestTimeGrain":"day","isDerived":false},{"name":"status","kind":"categorical","expr":"status","isTimeDimension":false,"isEntity":false,"smallestTimeGrain":null,"isDerived":false}],"measures":[{"name":"total_on_time","kind":"base","expr":"sum(on_time_flag)","dependsOn":[]},{"name":"on_time_rate","kind":"calc","expr":"total_on_time / order_count","dependsOn":["order_count","total_on_time"]},{"name":"total_ship_days","kind":"base","expr":"sum(ship_days)","dependsOn":[]},{"name":"order_count","kind":"base","expr":"count(1)","dependsOn":[]},{"name":"order_amount","kind":"base","expr":"sum(amount)","dependsOn":[]},{"name":"avg_ship_days","kind":"calc","expr":"total_ship_days / order_count","dependsOn":["order_count","total_ship_days"]}],"joins":[],"filters":[]}