{"schemaVersion":"v0.1.9-manifest","kind":"semanticdf-model-manifest","compiledAt":"2026-07-22T02:34:11.454146378Z","model":{"name":"usage","version":0,"status":"published","description":"Per-customer usage events (calls, data, SMS) with plan + promotion context","sourceTable":"usage_csv"},"digest":{"dimensions":9,"timeDimensions":1,"derivedTimeDimensions":0,"measures":5,"calcMeasures":1,"joins":0,"filters":0,"isStreaming":false,"usesTAll":false},"dimensions":[{"name":"usage_id","kind":"categorical","expr":"usage_id","isTimeDimension":false,"isEntity":false,"smallestTimeGrain":null,"isDerived":false},{"name":"promo_code","kind":"categorical","expr":"promo_code","isTimeDimension":false,"isEntity":false,"smallestTimeGrain":null,"isDerived":false},{"name":"plan_name","kind":"categorical","expr":"plan_name","isTimeDimension":false,"isEntity":false,"smallestTimeGrain":null,"isDerived":false},{"name":"is_roaming","kind":"categorical","expr":"is_roaming","isTimeDimension":false,"isEntity":false,"smallestTimeGrain":null,"isDerived":false},{"name":"plan_id","kind":"categorical","expr":"plan_id","isTimeDimension":false,"isEntity":false,"smallestTimeGrain":null,"isDerived":false},{"name":"event_type","kind":"categorical","expr":"event_type","isTimeDimension":false,"isEntity":false,"smallestTimeGrain":null,"isDerived":false},{"name":"event_date","kind":"time","expr":"event_date","isTimeDimension":true,"isEntity":false,"smallestTimeGrain":"day","isDerived":false},{"name":"customer_id","kind":"categorical","expr":"customer_id","isTimeDimension":false,"isEntity":false,"smallestTimeGrain":null,"isDerived":false},{"name":"customer_name","kind":"categorical","expr":"customer_name","isTimeDimension":false,"isEntity":false,"smallestTimeGrain":null,"isDerived":false}],"measures":[{"name":"avg_event_amount","kind":"base","expr":"avg(amount)","dependsOn":[]},{"name":"event_count","kind":"base","expr":"count(1)","dependsOn":[]},{"name":"revenue_per_event","kind":"calc","expr":"total_revenue / event_count","dependsOn":["event_count","total_revenue"]},{"name":"total_roaming_revenue","kind":"base","expr":"sum(case when is_roaming = true then amount else 0 end)","dependsOn":[]},{"name":"total_revenue","kind":"base","expr":"sum(amount)","dependsOn":[]}],"joins":[],"filters":[]}