{"schemaVersion":"v0.1.9-manifest","kind":"semanticdf-model-manifest","compiledAt":"2026-07-22T03:52:45.799580184Z","model":{"name":"events","version":0,"status":"published","description":"Real-time events arriving on the events topic, rolled up per 30-second window.","sourceTable":"events_stream"},"digest":{"dimensions":2,"timeDimensions":1,"derivedTimeDimensions":0,"measures":2,"calcMeasures":0,"joins":0,"filters":1,"isStreaming":true,"usesTAll":false},"dimensions":[{"name":"event_type","kind":"categorical","expr":"type","isTimeDimension":false,"isEntity":false,"smallestTimeGrain":null,"isDerived":false},{"name":"timestamp_bucket","kind":"time","expr":"timestamp","isTimeDimension":true,"isEntity":false,"smallestTimeGrain":"second","isDerived":false}],"measures":[{"name":"event_count","kind":"base","expr":"count(1)","dependsOn":[]},{"name":"total_value","kind":"base","expr":"sum(value)","dependsOn":[]}],"joins":[],"filters":[{"name":"require_known_event_type","expr":"type IS NOT NULL","appliedAt":"pre_aggregate"}]}